{
  "contract_version": "manualize-1",
  "operation": "write",
  "document": "procedure",
  "risk": "high",
  "profile": "strict",
  "glossary": {
    "terms": [],
    "abbreviations": {},
    "action_verbs": [],
    "phrasal_verbs": [],
    "hazardous_actions": []
  },
  "sources": [
    {
      "id": "SRC-1",
      "path": "docs/source.md",
      "sha256": "0000000000000000000000000000000000000000000000000000000000000000",
      "authority": "Name the source owner or contract."
    }
  ],
  "required_facts": [],
  "integrity_literals": [],
  "procedures": [],
  "warnings": [],
  "recovery_steps": [],
  "prerequisites": [],
  "branches": []
}
